[
  {
    "reference": "25/00989/PAN",
    "planning_authority": "North Lanarkshire Council",
    "application_type": "pan",
    "description": "Proposal of Application Notice: Data centre complex including data halls, substation, new road accesses, balancing ponds, security, associated development, landscaping, habitat and biodiversity areas (major application). Land At North Lanrigg, Carlisle Road, Cleland ML1 5LT. Applicant address F.A.O. Simon Munro, 33 Bothwell Road, Hamilton ML3 0AS (ILI Group's registered office).",
    "submission_date": "2025-09-12",
    "validation_date": "2025-09-18",
    "decision_date": "2025-09-22",
    "decision": "other",
    "decision_notes": "PAN closed with decision type 'Comments' issued 2025-09-22 (delegated); notice expiry recorded as 2028-09-22. Statutory pre-application exhibitions followed on 2025-10-21 and 2025-11-04 at Salsburgh Community Centre, with comments to the developer invited until 2025-11-26, meaning a formal application could be lodged from roughly early December 2025.",
    "official_url": "https://eplanning.northlanarkshire.gov.uk/online-applications/applicationDetails.do?activeTab=summary&keyVal=T2GYF2BA0P100",
    "last_checked_at": "2026-07-30",
    "events": [
      { "event_date": "2025-09-12", "event_type": "submission", "title": "PAN 25/00989/PAN received by North Lanarkshire Council", "source_ids": ["src-planit-nlc-25-00989-pan"] },
      { "event_date": "2025-09-22", "event_type": "decision", "title": "PAN 'Comments' decision issued (delegated)", "source_ids": ["src-planit-nlc-25-00989-pan"] },
      { "event_date": "2025-10-21", "event_type": "consultation_event", "title": "First public exhibition, Salsburgh Community Centre, 3-7pm", "source_ids": ["src-pnp-aurelius-exhibition"] },
      { "event_date": "2025-11-04", "event_type": "consultation_event", "title": "Second public exhibition, Salsburgh Community Centre, 3-7pm (same day as the Stoics press launch)", "source_ids": ["src-pnp-aurelius-exhibition", "src-bdc-stoics-2025"] },
      { "event_date": "2025-11-26", "event_type": "consultation_deadline", "title": "Deadline for comments/feedback to ILI Aurelius Limited (developer consultation, not formal representations)", "source_ids": ["src-pnp-aurelius-exhibition"] }
    ],
    "source_ids": ["src-planit-nlc-25-00989-pan", "src-pnp-aurelius-exhibition"]
  },
  {
    "reference": "26/00595/EIASCR",
    "planning_authority": "North Lanarkshire Council",
    "application_type": "eia_screening",
    "description": "Environmental Impact Assessment Screening Opinion request: 'Data Centre Campus Including Grid Connection', Land At North Lanrigg, Carlisle Road, Cleland ML1 5LT.",
    "submission_date": "2026-05-11",
    "validation_date": "2026-06-03",
    "decision": "pending",
    "decision_notes": "Status 'Pending Consideration' as scraped by PlanIt on 2026-07-28; target decision date 2026-08-03. Three documents listed on the council portal, which was unreachable on 2026-07-30, so the screening report content could not be reviewed.",
    "eia_required": null,
    "official_url": "https://eplanning.northlanarkshire.gov.uk/online-applications/applicationDetails.do?activeTab=summary&keyVal=TFC7RSBA0EC00",
    "last_checked_at": "2026-07-30",
    "source_ids": ["src-planit-nlc-26-00595-eiascr"]
  }
]
